{"air":{"path":"air-1fbd4c45b7e0da3270ea26b17631e4ed7b48dce7aaa25c3b804f3f3aa3d37c23.json","sha256":"1fbd4c45b7e0da3270ea26b17631e4ed7b48dce7aaa25c3b804f3f3aa3d37c23"},"correlations":[{"label":{"domain":"label","localId":"922aef9ead0e4063c3835fed371fce40","publication":"68c8cf01c60e9fdc86c2408735d15439","unit":"unit"},"operation":{"domain":"operation","localId":"5357696c937658b9eac2d662086444cd","publication":"68c8cf01c60e9fdc86c2408735d15439","unit":"unit"},"origin":{"domain":"origin","localId":"af6a9f04807da68d51de494977abd427","publication":"68c8cf01c60e9fdc86c2408735d15439"},"source":{"handle":"statement:1","unit":{"canonicalProgramName":"TARGET","compilationUnitId":"TARGET.CBL","structuralPath":[0]}}}],"qualifiedSource":{"path":"source-81a350a0cecc3c99adcb1e2a309b33fbd8a1bcfb251e59379f694f3d515d5c19.json","sha256":"81a350a0cecc3c99adcb1e2a309b33fbd8a1bcfb251e59379f694f3d515d5c19"},"schema":"dependency-input","sourceSha256":"0a8e4c188935d0a9ac0d4b789813c6abb759f0ee64d90a15bd65e9ca7376bb23","version":"1.0.0"}